{
  "schema_version": "0.1",
  "source": {
    "framing_path": "data\\acceptance\\frozen-20260910\\full-chain\\m03\\framing.json",
    "framing_sha256": "3f7796ccb23bbd329f1308864fdd797d4165406e62226b9a77e0ccb55102c645",
    "stream_id": "download-01-d8f9c37a5714-tcp-0-node1_to_node0-38c0c8258fcb",
    "message_count": 3
  },
  "status": "ok",
  "parameters": {
    "algorithm": "dbscan_precomputed",
    "eps": 0.25,
    "min_samples": 2,
    "max_messages": 1000,
    "length_weight": 0.2,
    "histogram_weight": 0.4,
    "prefix_weight": 0.4,
    "prefix_length": 16,
    "distance_formula": "weighted normalized length + byte-histogram total variation + prefix mismatch"
  },
  "assignments": [
    {
      "message_id": "download-01-d8f9c37a5714-tcp-0-node1_to_node0-38c0c8258fcb-message-000000",
      "length": 101,
      "cluster_id": -1,
      "is_noise": true,
      "distance_to_representative": null
    },
    {
      "message_id": "download-01-d8f9c37a5714-tcp-0-node1_to_node0-38c0c8258fcb-message-000001",
      "length": 101,
      "cluster_id": -1,
      "is_noise": true,
      "distance_to_representative": null
    },
    {
      "message_id": "download-01-d8f9c37a5714-tcp-0-node1_to_node0-38c0c8258fcb-message-000002",
      "length": 101,
      "cluster_id": -1,
      "is_noise": true,
      "distance_to_representative": null
    }
  ],
  "clusters": [],
  "metrics": {
    "cluster_count": 0,
    "noise_count": 3,
    "noise_ratio": 1.0,
    "silhouette": null
  },
  "warnings": [
    "Clusters are statistical groups, not protocol types or business labels.",
    "The precomputed distance matrix requires O(n^2) memory."
  ]
}
